标题,昵称,地区,评论内容
【横评】AI眼镜是玩具还是真未来？一个月真实体验告诉你,MVP小杜杜,未知,近视眼觉得戴起来还是有点膈应
【横评】AI眼镜是玩具还是真未来？一个月真实体验告诉你,日本还在排核污染水,未知,ai眼镜自动美颜[doge]
【横评】AI眼镜是玩具还是真未来？一个月真实体验告诉你,xslwin,未知,高考可以戴吗
【横评】AI眼镜是玩具还是真未来？一个月真实体验告诉你,imllllll,未知,感谢分享！这次横评分析了AI眼镜的实用性，非常全面。期待技术进步让AI眼镜更加实用！😊
【横评】AI眼镜是玩具还是真未来？一个月真实体验告诉你,青路鸣,未知,什么时候能透视看麻将[doge]
【横评】AI眼镜是玩具还是真未来？一个月真实体验告诉你,高端的昵称的昵称,未知,[思考][思考]
【横评】AI眼镜是玩具还是真未来？一个月真实体验告诉你,灵初残影,未知,对于我这种近视加散光的，还得多做几年
【横评】AI眼镜是玩具还是真未来？一个月真实体验告诉你,虚度无意,未知,小米是横屏！
【横评】AI眼镜是玩具还是真未来？一个月真实体验告诉你,蒸牛蛙wa,未知,续航和体积还可以继续提升
【横评】AI眼镜是玩具还是真未来？一个月真实体验告诉你,陌殊途左沐,未知,这仨都不是一个价位的咋对比，小米和meta基本保持一致价位，乐奇甩他们1k，没法比，毕竟多了块屏幕
【横评】AI眼镜是玩具还是真未来？一个月真实体验告诉你,彳亍泾,未知,近视党的福音，以后配眼镜更舒服了，功能更多[吃瓜]
【横评】AI眼镜是玩具还是真未来？一个月真实体验告诉你,灰度适中,未知,"感谢UP主老师的分享，感觉AI眼镜未来能更好地保护我们的人身安全。
最近在了解911北京于姓公民坠楼案，对安全问题感觉很失望和焦虑。
如果未来AI眼镜能够普及，相信在帮助我们更好地和世界交互的同时，也能更多地威慑黑暗和罪恶，更好地保护我们自身和周围环境的安全。"
【横评】AI眼镜是玩具还是真未来？一个月真实体验告诉你,谎言雪上加霜,未知,现在各家都开始搞ai眼镜了[吃瓜]
【横评】AI眼镜是玩具还是真未来？一个月真实体验告诉你,只懂皮毛的羽生,未知,没电了是不是就是近视眼镜了[吃瓜][吃瓜]
【横评】AI眼镜是玩具还是真未来？一个月真实体验告诉你,叫我芒果姐姐,未知,这种可以耶，不会想AR眼镜那个那么重，不累
【横评】AI眼镜是玩具还是真未来？一个月真实体验告诉你,天还黑的吗,未知,能不能ai一个于朦胧呀，真的好喜欢他
【横评】AI眼镜是玩具还是真未来？一个月真实体验告诉你,梦悻时分,未知,全塑料吗，重不重[抠鼻]
【横评】AI眼镜是玩具还是真未来？一个月真实体验告诉你,没有硬币陆小陆,未知,这个眼镜👓如果可以脱离电脑检测直接透视游戏，绝对卖爆[doge]
【横评】AI眼镜是玩具还是真未来？一个月真实体验告诉你,-千灯愿-,未知,题词器和显示翻译功能很不错，不过会被别人看到眼镜上的文字吗
【横评】AI眼镜是玩具还是真未来？一个月真实体验告诉你,Kevin_yepp,未知,感觉这款眼镜在画质，以及光线适应性方面还是有待提升，希望小米越做越好咯[doge][doge]
【横评】AI眼镜是玩具还是真未来？一个月真实体验告诉你,虚度无意,未知,读稿有点扯，读稿需要上镜，上镜眼睛上的文字会被观众看到，难道还有其他场景？
【横评】AI眼镜是玩具还是真未来？一个月真实体验告诉你,艾-倾,未知,电子防抖效果到底怎么样啊？实际走路，画面会不会晃得厉害？要是拍出来的抖得没法看，那这相机功能不就白搭了？
【横评】AI眼镜是玩具还是真未来？一个月真实体验告诉你,一只豿疍呀,未知,还没看，感觉是若琪商单
【横评】AI眼镜是玩具还是真未来？一个月真实体验告诉你,伴条鱼的青春回忆,未知,雷鸟老板都说了，再两年[doge] 我相信这里面有吹牛的成分
【横评】AI眼镜是玩具还是真未来？一个月真实体验告诉你,小狗子嘚嘚传奇,未知,现在这录制画面真的不行，还是底太小了
【横评】AI眼镜是玩具还是真未来？一个月真实体验告诉你,蒲萤玖依持,未知,"我们就近期发生的北京市朝阳区阳光上东小区某公民坠楼事件，请有关部门依法公开详细的调查过程及结论，并尽快发布正式的执法通告!
作为关注此事的公众，我们坚信有关部门在事件处理过程中始终秉持依法、客观、公正的原则。但鉴于该事件引起较多社会关注和部分网民的疑问，我们希望进一步公开相关信息，包括但不限于调查程序、证据提取、证人询问、技术鉴定结论及法律依据等，以全面回应公众关切!
执法透明和调查合规不仅是法律的基本要求，也是维护公信力、保障公众知情权的重要途径。我们支持依法开展的各项工作，同时也期待通过官方清晰、详实的通报，消除不必要的猜疑，进一步凝聚社会共识!"
【横评】AI眼镜是玩具还是真未来？一个月真实体验告诉你,爱囚黄昏恋,未知,这玩意就是为了看黄片，如果不是，那没用了
【横评】AI眼镜是玩具还是真未来？一个月真实体验告诉你,仰望星辰的蝼蚁,未知,明天加一手歌尔做中线。有sb可能说指数牛成啥了，我今天才5个点就是菜鸡……好好看看涨跌分布……
